{
  "schemaVersion": 1,
  "profile": "math-flow/work-accounting-transition-v1",
  "stage": "no-access",
  "problemId": "bssc-sum-capacity",
  "subjectTransactionId": "906894532b971ecf8c4ac6fcdd3f7380e00549b2",
  "bindings": {
    "rootContractDigest": "sha256:01d52a695e88694768973f3590c0c13eb5acd8070fbed32de8ad01e460c41135",
    "baseAccountingStateDigest": "sha256:a565cd4bf63e43981071e58e16ba3cfb3631b910ef0672f2e123c43e55a94dd1",
    "baseKnowledgeStateDigest": "sha256:6790bf618ff33d6171ec1d7d54fb0e9f1827ed28d743935afba31a8c591c4d00",
    "targetKnowledgeStateDigest": "sha256:a538e38923ffc39056053598a8c950230ae1a9b8c099b638402eb254e5c340c0",
    "topologyAlignmentDigest": "sha256:6253af560980f28acf54e8a5ffb83e1dcc75dd3eb3028f312e5d7025885edf15",
    "submissionEvidenceManifestDigest": "sha256:bdf86101ac115102a1f7e4baa33fc3932b22f93bd5462427c089b9c7bca2fc63",
    "submissionDigest": "sha256:c7858e2b6bff0ceaa7bbdfbe8116ce38142497169a5595cb038c043e4db64e57",
    "acceptedClaimRefsDigest": "sha256:443142aba0d1f06ba53a6595cec4119194349309036a90cd470d3962e364c7b0"
  },
  "rootContract": {
    "knowledgeProjectionId": "openrouter-research-v4",
    "knowledgeProjectionSpecDigest": "sha256:8bcab1fa785b4c5d757668ef2ff9ce1ef3046a54828c71ed846f84e6b33cf31a",
    "objective": "Determine the exact private-message sum-capacity C_sum of the half-skew binary skew-symmetric broadcast channel specified by the canonical problem.",
    "problemId": "bssc-sum-capacity",
    "referenceCommunity": {
      "description": "A counterfactual community of competent human mathematical researchers collaborating on the canonical BSSC objective, with its program and thread portfolio defined exclusively by the bound builder-v6 knowledge projection.",
      "portfolioAuthority": "math-flow-knowledge-state-builder",
      "researcherQualification": "For each local work package, a researcher with graduate-level mathematical maturity and the information-theory, probability, optimization, or computer-assisted proof expertise needed to begin productive work without general disciplinary training, but without unpublished solution-specific knowledge."
    },
    "rootContractDigest": "sha256:01d52a695e88694768973f3590c0c13eb5acd8070fbed32de8ad01e460c41135",
    "schemaVersion": 1,
    "terminalCondition": "A validity-v4 accepted result establishes one exact value of C_sum by matching rigorous achievability and converse bounds, including every limiting, cardinality, and certification condition needed for the canonical channel.",
    "workUnit": {
      "definition": "One focused person-hour of research by a researcher qualified for the relevant work package, using the fixed conventional tool baseline named by this contract.",
      "id": "competent-human-researcher-hour",
      "toolBaseline": "Public mathematical literature and standard non-autonomous research tools available as of 2026-08-25, including handwritten reasoning, symbolic algebra, numerical computation, interval arithmetic, proof assistants, and code execution on commodity research hardware; autonomous LLM or agent labor is excluded."
    }
  },
  "baseAccountingState": {
    "annotations": [
      {
        "annotationDigest": "sha256:036725e1d34b3067dfd0a7e5724dc2e8f09c4aa0969611ade43c614cddbd6024",
        "conditionalIncidence": null,
        "directWorkHours": "0",
        "knowledgeNodeDigest": "sha256:6c667e70ec5eeb0bbca5cc382893b021b8e4dff33403e3ec09d92532f24e49dd",
        "nodeRef": {
          "id": "root",
          "kind": "program"
        }
      },
      {
        "annotationDigest": "sha256:4bb4c666926a3dd4645f31646ddf77d2300a58dc9fc5d3507991dea9857a05e9",
        "conditionalIncidence": "1",
        "directWorkHours": "0",
        "knowledgeNodeDigest": "sha256:b9dcb917359a21c184538fcd5afde2659b0ec70a3c8b37cda415f835ceb7af26",
        "nodeRef": {
          "id": "root/code-structure-converse",
          "kind": "program"
        }
      },
      {
        "annotationDigest": "sha256:3103e057a9af12e6a44e6b6ea0103db46064b4e0033b146e46384b042c4dd020",
        "conditionalIncidence": "1",
        "directWorkHours": "0",
        "knowledgeNodeDigest": "sha256:9e2d5f65b5d7fb621be9b028ba18577c20ffb8d8d35cb6b5b20e9f4c489d1c06",
        "nodeRef": {
          "id": "root/multiletter-marton-achievability",
          "kind": "program"
        }
      },
      {
        "annotationDigest": "sha256:388135707b12111283fe709b566aae7115cfe796b51ee02f1e44aea592e1cafc",
        "conditionalIncidence": "1",
        "directWorkHours": "0",
        "knowledgeNodeDigest": "sha256:fc129ebc86b318e8a8c08037a21bfd1de61cb4401f11d9e1a8ae3b10cf1e634d",
        "nodeRef": {
          "id": "root/theorem9-auxiliary-receiver-converse",
          "kind": "program"
        }
      },
      {
        "annotationDigest": "sha256:2675ac5e7c1e535da2b29f924d71a4e24d019e20c87691d18d8bf6693cfa1943",
        "conditionalIncidence": "1",
        "directWorkHours": "0",
        "knowledgeNodeDigest": "sha256:fcc703456c24e5b4761dfb3ffca9cee02cb267bebe124a36811b185069a0daec",
        "nodeRef": {
          "id": "root/uv-scalar-converse",
          "kind": "program"
        }
      },
      {
        "annotationDigest": "sha256:6a4c515bdbce67d64c40b5f3c2ba84b9d19887f07414bf3b8c5cf171a5f9269b",
        "conditionalIncidence": "1",
        "directWorkHours": "360",
        "knowledgeNodeDigest": "sha256:be35b9071e3c1771d6de37cf8dedb082627ae39b1a8d02daa2cd2d4b401de358",
        "nodeRef": {
          "id": "root/code-structure-converse/dependence-balance-and-channel-refinement",
          "kind": "thread"
        }
      },
      {
        "annotationDigest": "sha256:f765f3cf0a74ad8bea3d3bb28d4c4460abaa157becd1d9cba647624182f67a7b",
        "conditionalIncidence": "0.3",
        "directWorkHours": "240",
        "knowledgeNodeDigest": "sha256:21542d60cc740c3de51655b277c1d05f68529005f8a3320e510f5e3b0dab75ef",
        "nodeRef": {
          "id": "root/code-structure-converse/unstructured-search",
          "kind": "thread"
        }
      },
      {
        "annotationDigest": "sha256:05259c79c31a835b1ba5c59ead75cad82b870ee21db8789c268349b74c497136",
        "conditionalIncidence": "1",
        "directWorkHours": "0",
        "knowledgeNodeDigest": "sha256:679d41ee0298d910e1478e4db57c4c44219afe8fef3abbdb7f461e27857d0234",
        "nodeRef": {
          "id": "root/multiletter-marton-achievability-agenda",
          "kind": "thread"
        }
      },
      {
        "annotationDigest": "sha256:da68674d75d0bac29bdad68a7cdac28b2274dda2a3fb8b4dbbeb3d3809d60625",
        "conditionalIncidence": "1",
        "directWorkHours": "0",
        "knowledgeNodeDigest": "sha256:dcaaa20d57507eb13133345aaea93697c978793f9d06c3c6d389c878ec78c6eb",
        "nodeRef": {
          "id": "root/multiletter-marton-achievability/conditional-product-and-correlation-pruning",
          "kind": "thread"
        }
      },
      {
        "annotationDigest": "sha256:79b9ffbe0c3c7f9a8ce48a7e44068e27783da816015e8d232e83cae2deb2d0db",
        "conditionalIncidence": "1",
        "directWorkHours": "0",
        "knowledgeNodeDigest": "sha256:6fcf79adb059247646b2762e903a027bdac85c4dd1efda87fc151390be5eb060",
        "nodeRef": {
          "id": "root/multiletter-marton-achievability/support-pruning",
          "kind": "thread"
        }
      },
      {
        "annotationDigest": "sha256:e74654db23e11159faaaebabdc4f8445d1969aae7f633c222ad6ede3838ea4b5",
        "conditionalIncidence": "0.3",
        "directWorkHours": "90",
        "knowledgeNodeDigest": "sha256:8de09a54e8183a3e9e37be60847de87b58b5595e9c54d7b7ea5bbed6dead8baa",
        "nodeRef": {
          "id": "root/multiletter-marton-achievability/unstructured-search",
          "kind": "thread"
        }
      },
      {
        "annotationDigest": "sha256:0b8d083bd204a595a59792756e63b4a89f0c992b345b54acee33c7af185972b1",
        "conditionalIncidence": "1",
        "directWorkHours": "0",
        "knowledgeNodeDigest": "sha256:45531074e7461c936ed926a0ca2727a7bba0463ec6b499a57982fb62dae84663",
        "nodeRef": {
          "id": "root/theorem9-auxiliary-receiver-converse-agenda",
          "kind": "thread"
        }
      },
      {
        "annotationDigest": "sha256:1ab63a46a561437d8706490345164d49c3919b07622be6f89b08d28f59190c14",
        "conditionalIncidence": "1",
        "directWorkHours": "0",
        "knowledgeNodeDigest": "sha256:e652298666da8a0fd022290925ba0067d21b2f217bdf432209dd068673c50a4c",
        "nodeRef": {
          "id": "root/theorem9-auxiliary-receiver-converse/r0-specialization-and-receiver-reduction",
          "kind": "thread"
        }
      },
      {
        "annotationDigest": "sha256:261f16ccedc06d9e9e0b4e9e131a516bdaa5d536fbd4cb137cb9bf1f4fd54c85",
        "conditionalIncidence": "0.25",
        "directWorkHours": "70",
        "knowledgeNodeDigest": "sha256:9f9280bbd49ae9d9fe41e5be39a13387a647aaf4dad7087c14b367b76b4f1036",
        "nodeRef": {
          "id": "root/theorem9-auxiliary-receiver-converse/unstructured-search",
          "kind": "thread"
        }
      },
      {
        "annotationDigest": "sha256:3bfa0c76881112d3081af6327f0adc753820071bffb7ec0aaac41c0254870faa",
        "conditionalIncidence": "1",
        "directWorkHours": "0",
        "knowledgeNodeDigest": "sha256:593d11c9f455aa91fa91e9083a6bb6ffcf4823726f6843239f552eb8fe24b48e",
        "nodeRef": {
          "id": "root/unstructured-search",
          "kind": "thread"
        }
      },
      {
        "annotationDigest": "sha256:83e1362bd2f173c3771989b872fa88e82a43d32f254c4afe4591e766d20a2717",
        "conditionalIncidence": "1",
        "directWorkHours": "0",
        "knowledgeNodeDigest": "sha256:1ec5b7ce786e9f1df13aab296e9407b0ecb76bc59c6201f87f03e4b745fb5e18",
        "nodeRef": {
          "id": "root/uv-scalar-converse-agenda",
          "kind": "thread"
        }
      },
      {